0,Acadia National Park
1,Arches National Park
2,Badlands National Park
3,Big Bend National Park
4,Biscayne National Park
5,Black Canyon of the Gunnison National Park
6,Bryce Canyon National Park
7,Canyonlands National Park
8,Capitol Reef National Park
9,Carlsbad Caverns National Park
10,Channel Islands National Park
11,Congaree National Park
12,Crater Lake National Park
13,Cuyahoga Valley National Park
15,Death Valley National Park
16,Dry Tortugas National Park
17,Everglades National Park
19,Glacier National Park
21,Great Basin National Park
22,Grand Canyon National Park
23,Great Sand Dunes National Park and Preserve
24,Great Smoky Mountains National Park
25,Grand Teton National Park
26,Guadalupe Mountains National Park
29,Hot Springs National Park
30,Isle Royale National Park
31,Joshua Tree National Park
36,Lassen Volcanic National Park
37,Mammoth Cave National Park
38,Mesa Verde National Park
39,Mount Rainier National Park
40,North Cascades National Park
41,Olympic National Park
42,Petrified Forest National Park
43,Pinnacles National Park
44,Redwood National Park
45,Rocky Mountain National Park
46,Saguaro National Park
47,Sequoia and Kings Canyon National Parks
48,Shenandoah National Park
49,Theodore Roosevelt National Park
50,Voyageurs National Park
51,Wind Cave National Park
53,Yellowstone National Park
54,Yosemite National Park
55,Zion National Park
